"# 文本key","文本value"
"string","string"
"id","text"
"492389292f5e200f6d1518055b0b1755","Здравствуй"
"0a9fd48bc656dc140b9d19b7c6fb543f","Subdialogue Flow 1"
"24651da3720b61bdfdca0972dae673e6","Testing subdialogue flow 1, 1111"
"0db6a7c82cb0f24d72e3e9f68190cd52","Exiting subdialogue flow 1"
"447f386a1fd1d9397a5452398df29df0","Subdialogue flow 1 -> Subdialogue flow 2"
"118f245c8f4004a15b5b02b62b05abf1","Exiting subdialogue flow 2"
"7e9ceb872fa8dbb0ec93660b706eff56","Subdialogue flow 2"
"23919a9ecdb31e7d808716f2d65eb06b","Ты победил моего врага, и я, без сомнения, должен тебя за это поблагодарить!! !"
"0bd3a1e12866fd4db04dbe32820e0fa4","Мы кровные родственники, вот что мне следует сделать! !"
"07f1effe8217ac63663cc0f5295aa240","Несмотря на это, я очень благодарен. Пожалуйста, возьмите эту вещь."
"a3fccde6074b2d61c53cfe00f09c95db","Отношение собеседника изменилось, и он подарил мне сокровище"
"94a5c429334328991826d2f92087293c","Я отомстил за {0}{1}, и {0}{1} не только стал со мной ближе, но и подарил мне сокровище."
"dd1105f15cf73be8f48e467ebddbb8e1","прощание"
"007f3352031a811c65c3559a22183632","Мы принадлежим к одной секте и можем сделать что угодно, приложив немного усилий."
"35af698f5324cc2ab53e3c5c9fe52b92","Поскольку мы из одной школы, раз ты мне помог, я никогда не забуду эту доброту!"
"9100a9df3937996496c4b4fa379a36f1","Мы давно знаем друг друга, зачем тебе это надо"
"f5ab0e4c2bf7ff0a6e134bf79cc96db4","Мы с тобой побратимы, Цзиньлань, и сегодня ты снова помог мне избавиться от этого плохого настроения.Я сохраню свою благодарность в своем сердце!"
"ecf7fcb456d48636c9a357ea5628009a","Я просто отношусь к этому спокойно"
"602a4206b53927505f414065a1f8e81b","В прошлом у нас была обида, но ты на самом деле отомстил за меня, несмотря на прошлые обиды. Я смотрю на тебя с восхищением и желаю заключить союз с висящим мечом, начать все сначала и стереть все обиды прошлого!"
"c32fcd011a0c446265fe3c84a426c5b6","Наша любовь крепка как золото, я приму меры против любого, кто посмеет сделать тебя несчастной"
"776550f80c204be0b1e3e81d212edfa9","В глубине души я знаю, что встреча с тобой — это благословение, которое я культивировал на протяжении многих жизней. Даже если море высохнет и камни разобьются, я все равно буду знать тебя и сопровождать тебя."
"a58e56e006072a2992f38de6b74a2cbc","Ты мой подчиненный, я конечно тебя защищу"
"d8539a499f9da9e07dcf34fb9e1ba845","Немного усилий, ничего стоящего упоминания"
"2f33b6d5204d36e70c126fbdd1ba219f","Молодой Мастер, пожалуйста, помогите мне! !"
"c3003f68037d2d0d2f0ceb662d21c64f","Спроси почему"
"886abe9ed897ddde7ae6567d9fbe0d8e","Это наше личное дело, лучше перестаньте лезть в чужие дела, а то и этим займемся мы! !"
"6256f6348e5d2200478318bc49d08cc7","Спросить девушку о том, что произошло"
"bd55b899bba71f2c54e8d080a75269c9","Этот злой вор продолжал приставать ко мне, но мой отец отказался и забил меня до смерти! ! Этот злой вор хочет заставить меня подчиниться ему Эта маленькая девочка скорее умрет!"
"ed15af327706592164eb4993e59b6c8a","Помогите девочке решительно"
"f399d9e9c9fd84be9ec6fa0a3e0ebaa6","Мальчик, я думаю, ты нетерпелив к жизни!"
"10f9ff5915ad633e5f99e51d6a39c086","Когда над девочкой по имени {0}{1} издевались злые люди, она обратилась ко мне за помощью, я действовал решительно, и она стала мне благодарна."
"cc6d41127f1db28321e805b15981162c","Преследуемый врагом и в отчаянии, он встретил Молодого Мастера {0}{1} и пришел ему на помощь, что заставило его почувствовать себя беспомощным."
"51479b8fa32d88d441c687b28ac1a36c","Отношение этих двух людей к вам изменилось"
"127a4c577dbc0a7c1a3269ead618748a","Без дальнейших церемоний! !"
"eb5deca5ad31e19dfe753f011c50871f","Я не могу тебе помочь. . ."
"bdd424d87b16971d535da34891cfcc7d","Если вы понимаете, о чем я! Девушка, посмотри, куда ты идешь!"
"53c53dd5a9a5c285f3b5ddef10d451f4","Когда {0}{1} попросил меня о помощи, я отказался."
"94a5d32f3c44abc352919913016e5b70","Преследуемый врагом, в отчаянии я встретил {0}{1}, но, к сожалению, другая сторона проигнорировала его, сетуя на безразличие людей в мире."
"132aadeea1adbec6fd73a76b9ea72761","..."
"b9a84afdb69bffbdc69432f9cccb4e77","Тон этого человека определенно нехороший! Я решил помочь девочке."
"184edf107672661e6ad0877601e56f20","Чем меньше проблем, тем лучше"
"962fb45d862a741b622877a2ba4927cb","Ты это слышал? Рядом находится бандитский отряд, творящий зло. Надеюсь, найдутся герои, которые смогут их уничтожить, иначе жизнь будет очень трудной."
"b1f8288af0a2cd45e37bb186260c514b","Это наш долг как рыцарей."
"36d5442ad05cc2f7a993592c865a66aa","Это не имеет ко мне никакого отношения, я просто хочу побыть один."
"542137d0f596b714c2554cdc85fa6b88","Ну... у каждого свои амбиции, не буду заставлять."
"e87b137568574805c1bc32304ad7118a","{0}, тебе что-то нужно?"
"58162032938f1dacda05a0b8c81f53f7","Твое присутствие вдохновляет, не оставляя мне иного выбора, кроме как восхищаться."
"0392d6b33e143b66f73c35eb1a908279","Ваше присутствие вдохновляет, не оставляя мне иного выбора, кроме как восхищаться."
"31368cb092d919fecd01c8c21235db14","....."
"786e5d6a0a32f21649a53503d6a37515","......."
"a62ae4cfd658c6e65778f0d06a03cde6","Ничего, извините за беспокойство..."
"0eec7b4ffb6701ffe63b497bb7d3a3ef","Спросите про все секты мира"
"1a41a3528c525f181bec55086624fa1a","<TDName>[Школа Зверя]</>Он изучил позы зверей луга, связь с небом и землей, владеет языком зверей, чтобы приручать птиц и зверей, и с помощью их силы его внутренняя сила глубока, и он изучил этот путь, и когда он делает шаг, звери поднимаются, и сила его подобна силе тигра. \\n<TDName>[Школа Льда]</> Культивируйте экстремальные холодные боевые искусства, внутренняя энергия холодная как лед, достаточно, чтобы заморозить три фута, практикуйте этот способ, удар ладонью, ледяная энергия пронизывает до костей, движения противника сразу же застывают, тело замирает, кровь застывает в жилах, остается только прикончить его. \\n<TDName>[Школа Пьянства]</>Погруженный в сознание пьянством, пьянство побеждает Акаши, пьянство не имеет себе равных, научился таким образом, после одной выпивки он играет пьяным кулаком, виртуальным и реальным, неожиданным, противник медленно впадает в состояние алкогольного опьянения, у меня не было сил сопротивляться, я просто падал и шатался. \\n<TDName>[Школа Скрытого оружия]</> хороша в использовании скрытого оружия, с бесконечными изменениями, а скорость стрельбы такая же быстрая, как ветер. После изучения этого метода скрытое оружие падает, как дождь, и противнику некогда защищаться. Он поразил много жизненно важных точек и залит кровью. земля. \\n<TDName>[Школа Рока]</>Изучите состояние обреченности и познайте искусство проклятия, чтобы привести противника к гибели. После обучения таким образом, с мыслью о проклятии, противник упадет в водоворот обреченности, и все пойдет не так, и вся удача будет потеряна, потеряна, морально сломлена, больше не сможет сопротивляться. \\n<TDName>[Школа Палящего потока]</>Занимайтесь пламенными боевыми искусствами, внутренняя энергия горячая, как огонь, и вы хорошо умеете использовать палящий жар, чтобы причинять вред людям. Изучив эту технику, вы сможете сделать ход. и огонь будет бушевать. Противник будет изрешечен дырами и кожа будет разорвана., испытывая невыносимую боль, изнемогая, и умер в жалком состоянии. \\n<TDName>[Школа Миазм]</> владеет всеми видами ядовитых техник и хорошо владеет хроническими ядами. После изучения этой техники, после отравления противника, он медленно теряет вес, теряет физическую форму. силы и страдает от различных симптомов. В конце концов, боль стала невыносимой, и я не смог ни выжить, ни умереть. \\n<TDName>[Школа Колдовства]</> Специализируется на искусстве внушения, используя всевозможных насекомых для манипулирования сердцами людей. Научившись этому, мастер внедряет насекомых в тело противника, околдовывая его разум, манипулируя его волей, подчиняясь чужим приказам и теряя собственное эго. \\n"
"3725d73dfaf45912b858800a1ad468af","Школа зверя"
"9402798306f7433e2d1943b12af7e21a","Эта секта основала <TDName>[Гору десяти тысяч зверей]</>. Здесь есть горы и горы, звери повсюду, птицы и звери собираются на этой горе, и есть на что посмотреть."
"c6a53cff9b65a49e1bebcf6474eb8c4e","Я выбираю эту секту"
"9d3b5a702f698feb5c30db0569edaebb","Я бы хотел рассмотреть другие варианты"
"08d6585bf533e892b58ca9eda0b8cff3","Школа Льда"
"4836cb08dea2ad2c838514c8d4ea3bee","Эта секта основала <TDName>[Гору Бэйман]</>, которая покрыта снегом и толстым льдом. Пик остается неизменным круглый год. В миле вниз по горе круглый год ощущается зима, а холод невыносим."
"011fddd37cca8c8ddde73e4b01036efd","Школа Пьянства"
"f76b648a27a5e6269e899aff0c45cbfa","Эта секта основала <TDName> [Озеро Цзуй Сянь]</>. Озера и горы такие красивые, с огромными просторами синих волн и красных лотосов. Напиток у озера опьяняет. Это действительно сказочная страна на земле."
"6c173f79e64df2314871f56ae749f863","Школа Скрытого оружия"
"da36eec1f250522d7d1fa05a5a7feccf","Секта этой секты — <TDName> [Бамбуковый бассейн ароматов]</>, оазис среди огромного песчаного моря, с голубой водой озера, зелеными бамбуковыми лесами, мягким климатом и приятными пейзажами. Это хорошее место. практиковаться в скрытом оружии."
"cc79f9bb5a477f77c1e68c950fb8bf74","Школа Рока"
"7d60d7de5eb5c299bb8a707eb0acceec","Эта секта основала <TDName>[Пещеру девяти волков]</>, страну желтого песка, запутанных пещер, тусклого света, полную волков и червей, жуткую и устрашающую, это лучшее место для практики искусства несчастья."
"dc9a5a966f578975ea061704e83f6a5b","Школа Палящего потока"
"20fa2b52246671ec0c80a649c654eadb","Секта этой секты <TDName>[Ущелье Красной скалы]</>— это место, где лава и извержения вулканов извергаются красными и обжигающими облаками, что затрудняет приближение обычных людей. Это отличное место для занятий жгучими боевыми искусствами."
"36a4a16d22b8c51a550f2eae317a80bf","Школа Миазм"
"05148366f287d950e27e3c69f89347e8","Эта секта основала <TDName>[Долину преисподней]</>. Это мрачное болото, повсюду ядовитые насекомые, повсюду миазмы, летающая трава и деревья. Если вы сделаете шаг вперед, вы немедленно будете отравлены. Это секта лучшее место для изучения различных ядовитых техник."
"ae9c14f71b2d5acef7ddfb954f35902c","Школа Колдовства"
"1c75654ad0220cc126a8c360315444a7","Эта секта основала <TDName>[Долину Дракона]</>, которая полна болот и является домом для насекомых вуду. Это природный рай для развития техник вуду и умственных способностей. Здесь собираются все виды насекомых вуду, что знаменит повсюду и его все боятся."
"5f411223ca5a01a5adf20fe735a433d0","Назад"
"965406c5acea596381f752a79f902bcc","На данный момент у меня нет информации о других сектах. Пожалуйста, зайдите позже."
"375ec8858f2e8ec21295958624199520","Хорошо"
"8ed984386ed172cbc082b9d57d5b2a70","Постарайтесь разрешить обиды"
"ffe5130ee258de6e75ceba8d3af72147","Разумно разрешать вражду, а не укрывать ее"
"97f51950e08de32ff752b606b0e995a4","Я не из тех, кто затаивает мелкие обиды. Давайте двигаться дальше."
"072b661e3ac3e467993e768d2d626cf6","{0}, у нас глубоко укоренившаяся вражда. Ни на секунду не думайте, что вы сможете легко ее разрешить! !"
"66c49424200c7ae9b8049519bd2a4da8","Ты прав. Но, думая, что это можно решить так легко, ты недооцениваешь меня."
"b6113aabe59dcddf0db86d1f6de77a3f","Выступайте посредником через свои связи"
"f1ccf648a3ae5572972ef17efe655776","У нас есть общий друг и отношение другой стороны смягчилось"
"1dfd6ab804dacc510074d9669e12de91","У нас общий враг и отношение другой стороны смягчилось"
"0d02f6815365b0a903e4dd601f0adf9c","У нас нет общих знакомых, хватит притворяться, что мы знакомы. Как смешно"
"63a9696bcc42d38cdcdec0430f18c418","Используйте свои связи, чтобы оказывать давление"
"b1489c652baa6028dad629d22da44fdb","Величайший высказался и я готов уладить нашу обиду. Надеюсь, я вас не обидел."
"93f8bb726e5e68244077d471d5f6da83","Что ж, давайте пока отложим наши жалобы в сторону. Но использовать демонстрацию силы для запугивания неразумно."
"9548a4d951db06add151ecb8dcd207f2","Хм! Еще люди? Ты думаешь, я тебя боюсь!"
"0e83f060ed8d05df545d22288b9c83a8","Предложить деньги"
"ee96a243350c2bda1c996a710f405ba9","Дайте мне 8000 монет, и будем считать, что эта обида улажена."
"d0175eea3836634b3767f14764682abb","Согласись на эту работу"
"e9a521d361caebe1f936fd9f38946831","Договорились! С этого дня мы пожмем друг другу руки и пусть прошлое останется в прошлом."
"7173f80900ea2ff9fec6568115611305","Отклонять"
"38d0a91b79c901cf5b74ecbea83c4464","Дай мне 5000 монет и мы будем считать, что эта обида улажена."
"6b7866d721ad1f9adc139f4c2448695e","Дай мне 2000 монет и мы будем считать, что эта обида улажена."
"f1647ea6ee1afe118095abb7e6201f5e","Я заслужил некоторую известность в мире боевых искусств! Даже не думайте покупать меня за деньги ! !"
"83713baadbb15c40484e83478375fb69","Использование слабостей противника для принуждения"
"01adc1ff84cbcb24a61fa16d85c41020","Хм! Я всегда был честным. Какие рычаги воздействия у тебя могли бы быть? ?"
"be753415a61507dbef74161d8336e773","Используйте силу, чтобы заставить другую сторону согласиться"
"006b76461c1d6946a077965e26fb6bb1","Вы верите, что кто-то вроде меня съежится перед лицом ваших угроз? Смешно! !"
"1f78f65f392a42947be025021db8f21d","Я могу оставить наши разногласия в стороне, но травля слабых не подобает джентльмену."
"ef37194bf4b6014fc1175fab340aea65","Моя сеть простирается далеко-далеко. Ты осмеливаешься действовать безрассудно! ! !"
"c2602d590aefdb857b49a9a698652147","Слишком слаб. Ты переоцениваешь себя, если думаешь, что можешь угрожать мне!"
"57d14bfa8e304db41a7daed6d6104ba7","Попробуй использовать словесную дуэль, чтобы решить проблемы"
"5d1acd210332d82ae3af58e9cab682b4","Говорите на темы, которые интересны собеседнику"
"39819f29d5933eec2b171a70062ac35d","Обсуждайте темы, связанные с воровством"
"df1cc557639ba9db39fe2fa9527aaeab","Обе стороны обладают схожими способностями и разговор был очень приятным. \\n Опыт соответствующих способностей обеих сторон +5%\\n Оценка меня другой стороной +30"
"8cd2cd54ab864e8a76d2120e58da5b0e","У меня ограниченные знания об этой способности, а собеседник находит разговор скучным. \\n Подозрение +10"
"85d9e63be3647bbd55076f8ca3e155c1","Обсуждение тем, связанных с медицинскими навыками"
"63a5f21cb353a52d97a50b84e391c59e","Поговорим на темы, связанные с ткачеством"
"802d024b9fd49c22b5223d5e7ef3ccf0","Общайтесь на тему крафта"
"8542b593289b9473dafba98bbea97fd8","Обсуждение тем, связанных со строительством"
"25bf43127c392f043afa41ff68c6ae3c","Поговорите на темы, связанные с приручением"
"90554c11a959a7590f6104286973c300","Обсуждение тем, связанных с кулинарией"
"0133f6ab0c1c339ef7a5e4e95c9d801d","Общайтесь на темы, связанные с выпивкой"
"3535efed48dd210ac263313e4575d00b","Разговор на темы, связанные с музыкой"
"6803120561ccc63776010eff00db2d6f","Поговорите о попрошайничестве"
"1b44823ed7250b83adeb6dbd1492f1cc","Обсуждайте темы, связанные со скрытностью"
"1091ea5db8bdb19a538868e265ecd7b6","Поговорите о кузнечном деле"
"c4b0436743e6f2eca23d9d2a42ae8e54","Я бы предпочел не продолжать этот разговор. Мне нужен четырехчасовой перерыв"
"a2ff92e4f2d985bf62adcc7735f81d8b","Допрашивать заключенного"
"ef297db73d4e0d97e8cb1874f761f721","Просить секретные умения"
"0c5a135d1279863dbcb5a2be6095069e","Я знаю навык, которого нет у тебя. Я могу научить тебя, только не мучай меня!"
"4d4bb57e9ca8fa5e1872b415f19292fb","Я презираю тебя! Перестань мечтать; если посмеешь, просто убей меня! !"
"2e0e59d4d6433c60c89751e43ef7c8ad","Ты уже освоил навыки, которые знаю я, так зачем же так далеко заходить..."
"7b3ce9bf2bab0bdea90cde4578241200","Вопрос о KungFu"
"e405d182e8759629d5b62f63881dba08","Я знаю внутреннее кунг-фу, которого нет у тебя. Я могу научить тебя, только не мучай меня!"
"51e2faf8059d231d6727cd77cdf77a24","Ты уже освоил Внутреннее кунфу, которое я знаю, так зачем же так далеко заходить..."
"73f66685d4eb431cea4d39ad19651b06","Пытать"
"ae65182f6346d9ede05dc794b3b293a4","Аааа! ! Черт возьми, я не чувствую ног! !"
"af118cd54c3a7dbbfae9cb8b4bade0c4","Мои... мои глаза! Будь ты проклят! !"
"8b842dcf525f92ae09129ca47cb8f85a","Пожалуйста, пощадите меня! Я больше не могу этого выносить! !"
"f914d12e2043b725a457f0c96b32d0a2","Отношение другой стороны смягчилось"
"962f156813fde7fa082acc7699fba498","Травмы соперника слишком серьезны и возвращены в Карму..."
"db84f1697c9979a605ca74cedba13bf5","......"
"394a805b0c32b486806bcde0dda13fb3","Возьмите его под свое крыло"
"3d7b52f87a63a992439adfd7cbbab48c","Теперь, когда моя жизнь в твоих руках, я готов тебе подчиниться."
"c6839f146f0ce9f142ddc10335e7ccc7","Ты бредишь! Я лучше умру! ! !"
"651a2fa9b36bc539195fcf22a0034767","Сделать комплимент"
"c8c0364ac88721cf594d88d3ad48db25","Сделайте комплимент внешнему виду"
"a5505db1b4c5f75f7bb513feb2491778","Похвала за силу"
"cfdc89379053f345ba316f0903401829","Похвалить за репутацию"
"02a70a6967959bd9c9de65202060ba10","Они чувствуют себя счастливыми, Восхищение +10"
