"# 文本key","文本value"
"32c58da785f53250c892055280649530","Что ты можешь сказать в свое оправдание? Я всегда ценил честь и порядочность, и я ненавижу тех, у кого испорченная мораль. Сейчас у нас с тобой будет дуэль. Если ты выиграешь, мы будем считать этот вопрос решенным. Если ты проиграешь... хм"
"f804ec1290ae1603ca58707dfb5699a6","Поскольку я принял руководство, которое украл и дал мне его ребенок, {0} {1} решил проверить мои боевые навыки."
"6d2987b9637223bc3b90908a09881ac8","Давайте начнем, пожалуйста"
"323aedb2ce330735220e9d0c6a638782","Предпочитаю ничего не объяснять"
"b81a52cf6bf05ed9ee18cee24d447275","Сейчас у нас с тобой будет дуэль. Если ты выиграешь, мы будем считать этот вопрос решенным. Если ты проиграешь... хм"
"7c7d9751a8d4794bcaac9c04567b7b15","{0}, я чувствую неуверенность в своем будущем. Не могли бы вы присоединиться ко мне и выпить..."
"3669935767be6a4c3c39378a3d970450","Выпейте и дайте совет"
"8210c2d8d33192e956b35c405653ba7c","Спасибо, что разделили со мной напиток, {0}!"
"83fe4283a1d6395772fc62f56905f5c3","Благодарен +50"
"6012b9e2561d0c4990a6b2220dda804d","Не за что, в любое время"
"d8b7ff87b910fa3b1b2e38f04ff4c1e0","{0}, Я принял решение. Я вступаю в секту. Спасибо за ваше утешение. Тогда и увидимся."
"2047cf7ee11159444a5d778fd9652b9b","{0}{1} обнаружили, что заблудились в жизни, но после выпивки и беседы {0}{1} обрели новое чувство цели."
"e3812972878607b59535f8a9498daa1b","Пока нет"
"487a5ce3ada3a6e02858e173f71dde9d","Что ж, тогда я откланяюсь. Тогда до встречи."
"6cfeac018b328a132c0d6112592a6700","Грусть +30"
"af8b9f806c0030a468cc9d5093b7c21d","{0}, я приложил много усилий к своему обучению и стал старейшиной секты. Если вам когда-нибудь что-нибудь понадобится в будущем, не стесняйтесь обращаться ко мне!"
"700210d90a18d6e835ee14c8f656a957","{0}{1} после самоотверженных усилий стал старейшиной секты и значительно увеличил их силу."
"9a10730281c4aa56d4f412cb241efb49","Поздравляю"
"afc45acd0fa87890b85aeed4f80ace04","Почему у тебя так сильно повреждена нога? Упал с горы?"
"2fa0560875d9abfe3aa9b5a1ebcca72a","Попросить помощи"
"6c6725f4998837f975aa5ca9a49e7e64","Тебе повезло, я здесь, чтобы помочь. Пойдем, я отвезу тебя лечить ногу."
"d3ae33277fba8b2748a1622150fd8093","Спасибо!"
"c14d4dff0c1256b8b4a8030634d14c71","Лечение травмы ноги может быть дорогостоящим, но давайте не будем об этом беспокоиться. Считайте эти деньги подарком от меня."
"938ff38e68448c7b7ca181e509ab6aec","Получено 500 монет"
"d11de3ba8b831bd8b8acd9027b33479f","Я повредил ногу, но встретил доброго человека, {0}{1}, который не только отвез меня в клинику, но и дал мне 500 монет."
"e2bb3e706549bfb0d62b35de7446e943","Большое вам спасибо!"
"a8bbdb64ffe05ead40dfacd248a5e8a1","Ты довольно тяжелый. Кажется, ты несешь много вещей. Я не могу нести тебя . . ."
"ed8b99b3042ebae47cf8f3aea1b9be6f","Ладно, тогда возвращайся и восстанавливайся. Если что-то пойдет не так, немедленно приходи ко мне."
"91de3402e20c447499f58b9b0b751c7a","Поскольку у тебя проблемы с передвижением, у меня здесь есть лошадь. Это обойдется тебе в 800 монет. Интересно?"
"4d9964dd3949c3a310093910345a5208","Спасибо за ваш труд. Тогда до встречи"
"c8bcea7943da99fc09c7cb8acd5480b2","Потратил 800 монет, получил лошадь"
"80ac0dde349ee62dd715762e5964cd4d","У императора есть приказ: \\n В сегодняшнем мире герои вместе, тревожа реки и озера.Согласно разделению фракций, по одну сторону раскола.Главные силы действуют ради своей личной выгоды, и хаос во Вселенной, так же как и страдания простых людей, является богатством и несчастьем.В реках и озерах также водятся отбросы, которые издеваются над слабыми и убивают невинных людей без разбора, так что порядок в реках и озерах хаотичен, и все подвергаются риску.Император сжалился над миром и с сегодняшнего дня он выйдет на арену и будет использовать хладнокровные средства, чтобы успокоить море и восстановить порядок.Любого, кто не следует морали рек и озер, совершает прелюбодеяния и преступления и игнорирует человеческую жизнь, Великая Внутренняя Стража привлечет к ответственности, наставив на правильный путь боевых искусств.Спасибо."
"d92fd2871a23604516d29b5e7121d45f","The Great Inner Guard, the imperial organization under the command of the Emperor..."
"c19f28153b941e87a2ba85168c512d6a","Rumor has it that the emperor has been ignoring Jianghu for a long time, why......"
"0533804cdaf18886f0b023a2aa79b05d","стоп!!"
"23d7bbaeddcaa7c11051c77a953e5787","Не сдавайся без борьбы!"
"ec164a040b063b19a0701276e4bfa693","Не убегай!"
"04a5af6357c0e9135237c591d1c8800b","Тебе не сбежать!"
"93e4220f427853f2a6cf59c348d596bd","Посмотрим, куда ты пойдешь !!"
"8f9164caf4bd6f4fcd3b1b4b0e968cc5","Ты совершил лишь легкое преступление, ты послушно платишь штраф, чтобы не попасть в тюрьму!"
"653914122fa95ec0616e935e4d4b2e0e","Сопротивляться"
"7490eb31092371c11be90bfc969bcd8e","Смелый !!"
"23bd61ea2993a670b67e14d60fc08a5f","Заплатите штраф 1000"
"272a25563ba6abc3ea7e57190bcbe67b","Запомни, ты не должен совершать плохих поступков в будущем, иначе железные стражи закона тебя не отпустят!"
"bafdffafb469e19639168df8aa975cf8","да!"
"8fc911bf254f754428182b26b8f34e92","Недостаточно денег, тебя арестуют"
"f6096aacd842038fcb08f44b54de6a11","Просто послушно иди с нами!"
"caff857d65be14215b419bda4aa5f231","Следовать"
"90a3d007e0e9beb0ce86757d79a7cf5f","Ты не закоренелый преступник, небольшое наказание и полный штраф помогут избежать тюрьмы!"
"9341969b689f5d484aae744f13dc9cac","Заплатите штраф в размере 3000"
"7fea45ecf15dd1870ff3f17604b2b195","Очень хорошо. Если в будущем ты совершишь зло, мы тебя не отпустим!!"
"3a62dd2239c18697d457cbd4f9a60181","Вы совершаете прелюбодеяние и нарушаете закон, а закон не может этого терпеть! Следуйте за нами!"
"a58a236c1533444718e12f317ff81384","Не принимайте близко к сердцу"
"e610c6da8f8f26971393a13ec3fbe164","Просто оставайся здесь, и я отпущу тебя, когда придет время!"
"4925a86143246d740facd8683b8a1b8d","Предложите 1000 монет"
"5e488802d32af801e72ab2afaea398bc","Хаха, ты очень мудрый. Я могу только помочь тебе смягчить срок. Ты должен быть хорошим человеком, когда выйдешь на свободу."
"04e352964bf8da0996f4718e7b9ae8d9","Мой приговор сокращен"
"b9d8e8cb67af666f7f01dcd3c7d402e0","Предложить 8000 монет"
"d06928f0ea759fb3fc46e262ec174a94","Я не знал, что ты такой богатый, так почему бы не добавить еще 8000? Я хочу жениться, так что не скупись, ха-ха-ха~~"
"642cbc3261a8ff98aa5bf8124513ae42","Если кто-то нож и солдат, то я рыба и мясо, поэтому мне пришлось согласиться."
"a99cee55acb4a8720cabf627c2b2ef4f","Потратил 16 000 денег, он очень счастливо рассмеялся"
"4a9d828c2b9ff27f763fbf816daeff28","Удача, ха-ха-ха, с этого момента ты будешь моим братом, в будущем нам нужно чаще видеться~"
"aa2d9b658449bad7b8dfab684c11a075","Спасибо, Мастер ~"
"59dd5bad73bd31c27587b3295736a9d3","Хах ~ я не знаю, как это стерпеть! Вы просто взяточники! Просто подождите!!"
"a8a6c9ff657cdc563f40346b56ed6d9a","Срок наказания увеличен на 20"
"7ceb3f9b2970868f68101def403d8b8b","Я это запомню!!!"
"601587c9ae0697bd6b0b81ce1d3d3267","У тебя столько нет! Ты хочешь солгать этому дедушке?"
"bc27dd786e87046c7c07a3cbb094efac","Сэр, успокойтесь, я буду вам должен!"
"34cd0b96872f314c02d17d7c7ea84ba8","В таком случае, сделаем сумму круглой в 20 000 монет?"
"9420280c270970107bb158dd0fc0b16d","Я должен 20 000 юаней, он очень счастливо рассмеялся"
"153ccb1aa9fe8ad36166604165145158","Нечего сказать"
"bc7844974dfbae56494f89fb8dd46868","Ага ~ Этот дедушка будет ждать!! Отнесись к этому честно."
"030f0dfb71483cb7f82d99e64db1a7f8","Пора.~~ Я тебя подвезу. Ещё хочешь сказать что-то?"
"956453f917e51c8085c4a3c99dda1635","В следующей жизни будь хорошим человеком !!"
"75ab99b65a387683bf8e5ae67e285aed","Попробуйте подкуп, чтобы выжить!"
"7dfee8f368bbd923f3678c7b42bce47a","Ха! В тебе много зла, это настоящая смерть, будь хорошим человеком в следующей жизни."
"d2d68993bcd509fe2fe98e41e42c6f0e","Бросьте кого - нибудь под нож !!!"
"74ab01f4a90aca2568a485d6a28eed6f","Спасибо!!"
"5f5b82ba4c3d7dc0bf7f077b7201a310","Секретная разведка: Группа людей, которые на вас обижены, сформировали альянс, чтобы подготовиться к уничтожению ваших боевых искусств!"
"07c5d6277755164b67b52c9c2bee45bd","Экстренная секретная информация!"
"05c36dd290a71eee1be1b168394dab8b","{0} {1} и многие другие люди, которые обижаются на меня, создают альянс,дабы уничтожить мои боевые искусства!"
"2f7167aa725c9b6bcb5208bb62be9f6b","Я вижу, что твои навыки сильны и твоя аура поражает.Ты должен быть мастером внутренних навыков. Интересно, готовы ли вы научить меня своим внутренним навыкам? Я готов заплатить, чтобы поучиться у вас."
"ebd41382081c33169bdb11220bfa5bc5","Знакомьтесь друг с другом и заводите друзей."
"a4944c0d92c5c1e0e49ac3e751c72361","Ха-ха-ха, ладно, раз мы друзья, как я могу получать ваши пособия бесплатно? Это таблетка, передавшаяся от моей семьи, поэтому я подарю ее вам как свидетель нашей дружбы."
"af53dc9e960c67558c92849ae6dd305a","Очень хорошо."
"8936181bbd800ebd7bb4f8884436e965","{0}{1} проявил интерес к изучению моего Внутреннего кунг-фу. Вскоре мы подружились и обменялись подарками."
"4ee94a9736b02e72500ba67c84b1a669","Требуется 1000 денег."
"af9dd32ccaaee0c99afb97afe943b96f","Это более чем справедливо. Возьми это."
"d1066dcac36f0171dafe5fe8681ae32e","{0}{1} хотел купить Внутреннее кунфу, которым я занимаюсь и мы заключили сделку."
"442004281180cf4ebdccda805a2d8a33","Мы заключили сделку."
"9957a93ce33c768d6d1e720b3c2ad001","Требуется 10000 денег."
"e37bed0db9d3c7fbdcb7a8bc9f44c0ba","Ты хочешь 10 000 монет за свои скромные навыки? Тебе просто нужно кого-нибудь ограбить."
"e4a0dcd697f9ee92f645d7c4e13fd7b9","Имеет смысл сказать, что изъятие денег теперь является ограблением."
"a94ec864ad900a0b99bd66b055dfe6de","Вы осмелились ограбить меня при свете дня. Сегодня я восстановлю справедливость!"
"e5fad432a9d040157e49825e2a891349","Ты слишком много болтаешь."
"575d8233ece29b7d2cc5a109d51eb915","Какова ваша цена."
"0010358c86dca711522288c1b985bdef","Не больше 2000 ."
"928811fa7c28ab854df461fc8ce0eab9","2000 - это немалая сумма."
"2f773b95d0a5d6911967bdc409cc0edc","Вот 2000 монет, возьми их."
"4cd80280d3d099b10e8acb269102107c","{0}{1} хотел купить Внутреннее кунфу, которым я занимаюсь, и мы заключили сделку."
"16caadb30ef909a551fe70a135a04338","Неважно, я передумал продавать."
"0e8448c94b04651544b39cf368be0934","Тск, что с тобой не так."
"653977dfa27031b52ce93c0ef2710396","Друг,путешествуя по миру,важно не хвастаться своим богатством.Теперь,брат,я знаю,что у тебя в руках много денег,так почему бы не одолжить немного денег брату?Тут неизбежно найдутся люди, которые будут жаждать ограбить тебя."
"d33a4336819ba11c25fcc64678a8eac0","Шантажируешь?!"
"822930508a50a7186373e2274359e4b6","Хе-хе, приятно знать. Если на этот раз ты не дашь мне 3000 денег, я заставлю тебя хорошо выглядеть!"
"7ac1ef9c94de718b928cbc1122fe63b9","Ситуация не так хороша, как у других людей, поэтому мне приходится на какое-то время проглотить и подавить свой гнев."
"71bf9ffc1c148c97220631345c23acac","Ты мудр. Если у меня когда-нибудь закончатся средства, я, возможно, приду занять еще."
"cf1bbb8a88a86d863d8d2877d3277f30","Боюсь, рано или поздно он снова придет просить денег."
"f1a307e2b433fbe040b611e9f34c3d56","Откуда взялся вор, это действительно свалилось мне на голову."
"3b8b5022c77cb2bf49897ba525e4ccd7","В этом есть смысл. Дать деньги."
"4eaf72202307b6528d868abbadbf963c","Хе-хе, спасибо, друг. Возможно, мы сможем выпить в другой раз, мой друг. Хи хи."
"7028148779c855df86ab3bff1ca45db5","Безопасные путешествия."
"fd3ae770b5adf96e45020f89497d88d5","Братишка, ты знаешь, кто я?"
"cbf017a8aef1564abc07bed53bc8f9df","Прости мое плохое зрение, друг мой. Я, должно быть, обидел тебя. Я нарушил правила мира боевых искусств, считай это компенсацией."
"72db6aded1611639f958ee9f30f0ff7e","Жизнь длинная, мы можем встретиться снова."
"ab468ca6c2ecba349752d00da41e92a9","Я Старейшина Секты."
"02fc824402bdab9b1f71439f1cf28d00","Я Мастер Секты!"
"bd00a2c66ade78474ff637c018cc661f","О боже, этот дурак слеп настолько, насколько это возможно! Это золото в качестве компенсации. Пожалуйста, просто отпусти меня, как будто меня никогда не существовало!"
"1964bddbab57b14188a609ca451e7531","Просто уходи."
"f00d528b6de93df84658a9cf596f7b8d","Я Величайший!"
"c8593d3bd6f9fc84d8feb976007c582e","Что? Величайший...Величайший? О боже, этот дурак слеп настолько, насколько это возможно! Пощадите меня на этот раз, милорд - мне нужно кормить стариков и детей. Такая ошибка больше никогда не повторится, клянусь. Пощади, пожалуйста, сжалься!"
"a4219e811451800d001b90c032f5b30f","Оставь свое кунг-фу и я оставлю это без внимания."
"c347598c9af702f3266ecf2c90780f1e","Спасибо. Спасибо."
"2196a982b4cdffa4a33922641369d7d6","Уходи."
"0c39d07803e17745eadbcbfe866b42b7","Ой-ой, у нас проблемы."
"24d3971d493fc788b3cbc9219dc30d83","Ослепи себя, и я оставлю это без внимания."
"1ea7797606b58710402681479a8f8dd0","Покалечьте себе ноги и я оставлю это без внимания."
"138ec77c441645384cfd1cb1834de956","Оставляй свои вещи и проваливай."
"8d45f54f878b6d1a4753d185ca238be8","Еще раз перейдешь мне дорогу и будешь все равно что мертв."
"c71884ccf5f44f7699353f2f347d732e","Дерзай и покончи с собой."
"45c2b5b31b839cadcb18d752605e08b9","Что? Пожалуйста, смилуйся, мой господин!"
"de0c5b60a2cb7c7ab9fe0b7ec32dfe34","Ты хочешь, чтобы я расправился с тобой сам?"
"479104623b5eccc395fa556162d05b70","Черт возьми, я не сдамся без боя."
"6106c33d8f2e206927eae5c53f73b74d","Хм! Какая дерзость!"
"5ef349d683056984bb5e62bcfa512742","Это не имеет никакого отношения к моей семье. Пожалуйста, сжалься над ними, Величайший."
"c64b452717a1ff11293b6cd32eb17890","Не трать мое время."
"e7f3a8fb44cc1b12d6efc332ff6e48c1","Черт возьми. Умри!"
"0cc710d1e1124d220e348c168f4a133e","Этот человек осмелился на неожиданную атаку, когда вы ничего не знали. Но как может их слабое свечение сравниться с блеском луны в небе."
"cede8921dad20076fe004c28352d8a11","Это все, на что ты способен?"
"aa391ef520df62406c076b03826a8b21","Ах! Нет! Я не согласен! Я не хочу!"
"984067dc78321b85bfddfb1aba3d266d","Хм, так самонадеянно!"
"87dfdec64d738cec64ef087aa2386093","Это не имеет никакого отношения к моей семье. Пожалуйста, не обижай их, Величайший."
"2918b4b44a74da4ac76ca25c873d906b","Ну что ж. Пусть живет."
"77e266cc49f97b175e3954010b4a3b3d","Хныканье не поможет."
"f20b7fd4e85fca398413d250c3d9a2a6","Увы, я сам виноват в этом."
"2b52cbadc74d819899307be1ad1585e7","Свяжись со мной и смерть будет слишком мягким приговором."
"d07ba5861b478b4f50c8fea0bcb92ef2","Черт возьми, я не сдамся без боя!"
"2731f733a2915945261c3e706479c1fd","Думаешь, ты меня пугаешь? Ты заслуживаешь хорошей взбучки!"
"00e8837fa7817a46f23b588636ec8474","Молчите и сражайтесь."
"80323a8ed807084476afb6bd28b34aed","Простите, вы победили бандита в этой области?"
"a8db5299550007bf0f86089eba3fb00b","Что, если это был я?"
"6b1acdeada4a8a0839b38cf34e3ddc55","Этот бандит был здесь проблемой и я выслеживал его несколько дней. Я не ожидал, что такой герой, как ты, справится с этим раньше меня."
"a525ea987ab968bcd0dc3cdc48e1c0bc","Наш долг - отстаивать справедливость."
"0b200deac4c4cdbe227869f04b08d8b9","Прими этот знак благодарности, благородный воин. Когда сталкиваешься с несправедливостью, не стесняйся пустить в ход свой меч."
"d7c765ca86d69fef81b6da06fc77d9ba","Конечно."
"213b908dcc410fc736a8751c516f73f6","Ему не повезло пересечься не с тем человеком."
"f9b638109671a99a3cf00dedd7fbe26b","Твои слова действительно справедливы. Этот негодяй получил по заслугам. Мне нужно заняться неотложными делами, поэтому я прощаюсь."
"fcd9d11b25dc38c234cd04aa1c357411","Вы меня с кем-то перепутали."
"26fde8e985a6618d320e51ee7dc4b3d1","С тех пор, как ты присоединился к секте, я наблюдал за твоим прогрессом. Я хотел бы вместе совершенствоваться. Ты согласен."
"ff93301ba9d4547e27705e3232310042","Давайте спарринговать и оттачивать наши навыки."
"b706c438e85672665129f2e9e71f0b5d","Хорошо, давайте проведем товарищеский матч и остановимся, когда сочтем нужным."
"efcb30aa6c82e5d0cf61278f7970b91f","Я готов."
"ba3adc0b09d8daa4c3298b01adb699f9","Мне это не интересно. Возможно, в другой раз."
"1fd800eec9697dd7f99c6d0637e07b15","В таком случае я не буду вас беспокоить."
"dd7b58ab5062f3b632e63d82cfeb7046","Что, если мы немного подсластим сделку?"
"6f20704788af6dde971a154d505e4396","Нам, мастерам боевых искусств, следует избегать азартных игр, но возьмите эти 500 монет в качестве моего вознаграждения за наш спарринг, если у вас не хватает средств?"
"684597444d426bf2fe38f0e79c066ecd","Так хорошо!"
"0d21f2fc919001019247f927f11a3035","Чувствуя себя неловко, давайте проведем спарринг без привлечения денег."
"e7ce22796b91fdcefb68b8c71ebaf6e4","Ладно, давайте проведем спарринг. Приготовьтесь! Я делаю свой ход."
"7dac0e375751bb04ec9558cb5006cca5","Давайте пропустим спарринг."
"de48cea9a98b880cd5435e0d50e4a893","У тебя есть неотложные дела? В таком случае я не буду тебя беспокоить."
"cd03a99fd852a96911ef5ab5bf1bcba5","Я усердно занимаюсь боевыми искусствами и теперь добился прогресса. Надеюсь, вы сможете посоревноваться со мной и дать мне свой совет."
"b71d2fc16138411e2a6ecea0bba6d79c","Как глава секты, вы можете учиться у него и искать наставлений в боевых искусствах."
"d1f12727ef160f0196af4dc2ecccfb5d","Как старший,вы можете учиться у него и искать наставлений в боевых искусствах."
"4cc05c8a6f9f02384227f99ab3e6c0ca","У меня есть дела, которыми нужно заняться. Возможно, в другой раз. (Отказаться от спарринга)"
"22863e3586cbca94a65526ba4228b6ff","Я нарвал цветов на дальней горе. Разве они не прекрасны?"
