"# 文本key","文本value"
"93dd725c5ed2aa22758e3f3d83dd32c2","Strange, could it be stolen by a thief?"
"ae66e623b69ee303a01a0f410e44ac2d","Meeting is fate, no need to force it, goodbye."
"ef03419eab588e8c271712e131810330","Tell me more, tell me more, what happened to Grandpa Monkey later!"
"6c153cf9081bb7250628e23663a9c039","You are born with animal language, so you can understand what these monkeys are saying."
"71bb3937a8a19ce9fdc331026839e9fa","Hmm? What are these monkeys doing here?"
"ac3c1ed36b84392adfe773ce8d1fca61","Later, the Great Sage made a big fuss in the Heavenly Palace, and the Four Heavenly Kings were trembling with fear, and the Thirty-Six Constellations dared not speak. He was truly the greatest monkey in the world!"
"1d3485be73664d72ab00cff00a31b664","Okay, okay, tell me more, tell me more"
"66af86247ba129a9594d136b52f50c9e","It turned out that they were telling the story of Journey to the West..."
"66226060f0a151b5f58d6579fe4f7ccc","Hmm? My king, no, there are people!"
"c7d540eb86e611c21912e1d90b457522","Hmm? Who dared to disturb the Little Sage from listening to the story!"
"bc751a1d3efbd97c93fa15599ac28df8","It was discovered, and it turned out to be the Little Sage Equal to Heaven!"
"85d9e3568fedfef64f39d338f60c5457","You? Are you a human or a ghost? How can you, a hairless monkey? How can it speak human language? ! "
"79849084313173a9e03567bfed2fcf48","The monkey immediately jumped to your side, and then showed an expression as if it had seen a ghost. "
"a7cf0f1e0c12bd83c5b96d7274da7164","You beast, how rude! (Battle)"
"2a4b795ed7f78b5bd4b6662a9b2b5730","Don't panic. I naturally understand animal language and can communicate with creatures like you."
"b146825a704559b0bbdf2e4aff6c985c","Interesting, interesting, this is the first time I have seen a hairless monkey that can speak human language! "
"05b7ae6fdfdbc488622a19510e4872e6","You can sense that this monkey is highly intelligent and already has a concept of humans."
"c68de235a3950dad8ed0f72a0e85042c","Praise it."
"73eaba4fa3bc266bcb0d0099fee329ec","I heard that there was a little sage in this mountain, leading a group of monkeys with great prestige, so I came to pay a special visit to him. "
"7750d91a861708c116f750d0811915ec","Oh? Roar, so that's how it is, so that's how it is. Has my reputation spread so far? Hehehe, it seems that I, Sun, can also become a monkey as upright as the Great Sage! "
"29959c18da1435116e9bf47805de5b99","Continue flattering."
"23a998a50d8640fb83e06b85874d2a5a","Indeed, recently, people in the martial world have been saying that there's a Monkey King on this Golden Monkey Ridge, whose Monkey Fist is unparalleled and invincible. I wonder if I could be fortunate enough to see him?"
"3775733353bf2b5b46a969104585a1e5","Ah, hehehe, alright, alright. You just want to see my heroic demeanor, right? Watch closely then, hehe."
"2065ddaa0ec8011d4759b8304cccd013","Steal insights from the technique."
"6d821773219b551862055faac283aa72","(The Monkey Fist has a unique charm, as if illusory. If one were to describe it, 'Heart of Ape, Mind of Horse' would be most fitting.)"
"75127c11c61037ae3269c3aecc6c0963","Oh? Oh? What's happening?"
"0be996b5d7e3f2517466193bda5c4b79","Thank you for passing on your skills, Monkey King!"
"49991dc015b69afbab1a6a0a372d5fe4","Huh? Passing on skills? What passing on skills?"
"d63e257633138f4ea64f2f8f177f988c","These hairless creatures are really strange and puzzling."
"ea39a66be2532e834093b3c57f42b50f","Your Majesty is right, it's really strange!"
"d6e552ecb037a34dc0de02b6c0c03125","Haha, bring some good food to thank the Monkey King another day. Farewell."
"09b9a28e85f2f81f84e6efc5eb45bbc7","Attack him. (Battle)"
"4048ed11c80b95c8f805d90ea6c439a2","Chijijiji! Gugugugugu!"
"50253bdb6a70a4275df333dab7c8a88c","I wonder what these monkeys are talking about."
"d9f28c3563e808a5c00c1ca319f075f1","Before you could react, the giant monkey had already launched an attack towards you."
"da01bb1c5a604ec9d991868ea101148a","Battle."
"9c1e5315240cdcd9e90886829d58ade7","After the sad old friend left, I ignored the new poems.\\nThe faint clouds and the pale moon, facing the river and sky, who can I entrust them to?\\nI recall them in vain, the fragrance has not diminished, and the elegance is no longer known."
"317d3795d032e97b66c4734ed860e38a","But it's old things. When people get old, they like to recall the past, which is unbearable. But my friend, why did you come to this barren land?"
"097c72809bddbb6437ebaa3bd7f820c4","Sir seems to be worried"
"a91b1467bd899b596522c77f89dc43dc","I want to go to Longquan, passing by This place"
"bec01810eb18ee65721a607942e4ca1a","Is that so? If you have nothing else to do, you should leave here as soon as possible. Longquan Town is still a long way from here, so it is better to get on the road as soon as possible."
"2d23d48121e0c3a404d971187731a99d","Why are you chasing me away?"
"11d364262a529438b3978226a0c9112f","Is there something wrong with this place?"
"e7a1b89c0753be043b171ea377cc3daa","Haha, you are smart. I really don't want you to stay here. When the Northern Territory invaded the south, countless people were killed. "
"e920b741819f7a99b051e40b76d9ea11","One of them was called the White Bone Mage. He was very good at poison and poison. In the end, three masters from the Central Plains killed him here at the cost of their lives. His power was dissipated, so this place was full of poison and poison, which was extremely dangerous. So I advise you to leave as soon as possible and don't waste your life. "
"d5acb1cae59aae5fa0953c595838409b","The poisonous miasma here is spreading because of that Northern Territory Master, it's incredible. "
"4d19816b131bbe1068e41719c07518f0","It's just like that..."
"74df146adf74ae1edf29efde3b0dd8f3","The poison method in the Northern Territory is different from that in the Central Plains. It uses the body as a keeper, and the insects are planted in the body, feeding with blood. As deep as the body, the internal organs are all the nests of poisonous insects. Every move will cause the poison to overflow, which is terrifying. "
"cb30c3bbb3d6ac6646a8170df0f664e4","But this is an evil method after all. After feeding the insects with blood for a long time, the blood will be exhausted. Therefore, it is necessary to kill people to get blood, and use the blood of others to activate the body, otherwise there will be the pain of thousands of insects attacking the body. "
"1181719c4222ab5ea896d9ab3bb250af","However, the dangers here are not limited to this. The white bone wizard raised the insects for decades and finally raised a poisonous king insect. After death, it drilled into the ground veins here. It is extremely poisonous and will kill anyone who touches it. This is the main reason why I advised you to leave."
"1b35a5f3a7ceb1c0492686169547aa43","Thank you for telling me."
"0a3fb461fe203c0ee3d10e28cbdaf8e1","You should leave quickly."
"54967ea47351fc54e5981306043b117d","I came here out of interest."
"07f1a5ed5284a64cb69e8ee4d706e705","I see. If you have nothing else to do, you should leave early."
"3da0ee423d90ca96038261d6a3fdc6bd","Hmm? What is this?"
"9a4c40fb0e6f284cccd13f9fe710c070","An unknown tomb."
"671c122ee73cd5aa73cf08e61c5a6341","In this world of martial arts, it is normal to have an unknown tomb."
"9b5f71d6d05b51002bb2e48723d4093e","Nothing special."
"4d47834cde0a789f1f4fb2890288ae94","【Bone Master】"
"58d0fb2da015238e859848b0fa4b6e16","Could this be the tomb of the bone master that Mr. Sansheng mentioned..."
"386270ce70ce7f4dee176854f9ad2ca4","【Escape】It's too dangerous. Leave quickly."
"e115de34f39b0c308033079403bf91b4","According to Mr. Sansheng, the bone master's poisonous skills are amazing. Don't worry about it. Leave quickly."
"0a5ada90baf0eca1b301b659de9d72c5","Leave"
"999f741a270114d5f98f6f10cc0034a2","【Explore】The Gu King may be here!"
"de01951e3f965ca6df85ba189fd3d0a5","I heard that the Gu King is here, maybe in the tomb of the White Bone Mage!"
"dc9de836036ef8af768d0de67a537258","Dig up the tomb!"
"c0d865845860711c299e35ea722fde9f","When you dig up a corner of the tomb, a pungent smell immediately escapes. You have no choice but to inhale a lot of poisonous gas, which makes your chest burn with pain."
"a3c89e356a49b51478408d5fef939ab5","Qi and blood decrease by 200"
"103825fa99ef53a83fdd7a6f512e6937","There must be something! Keep digging!"
"7c0a290fafa957cac9002c66c1c7f17b","Push the tombstone over again, and a dark green liquid will seep out immediately. You can clearly see that the liquid comes from a skeleton full of holes. Many Gu worms are constantly moving through those holes, which is very creepy."
"e53dae84ec4cd5116f626660545435c5","Qi and blood decrease by 300\\n Mood decreases by 50"
"c6c7f771c09a892d29ea760561e4d398","Keep digging!"
"e5909b774347b91644574d46a0814332","You endure the nausea and the pain of the dark green liquid burning your skin, and move the skeleton full of holes away. Among the large group of Gu worms, a fat giant worm is among them. The dark green liquid also comes from this fat giant worm. The body of the insect seeps out! "
"61202380551016041000b140cf84a20a","Qi and blood decrease by 300"
"93ba697075ee58adaf8c639f8e7f8bfa","This is the insect king! Catch it!"
"f9b2bd43760c7f08055f94ec00e8ed84","Raise your hand to catch the fat insect, take out a cloth bag to put it in! "
"70fe56bb986807307c11da0e5c15418e","Toxic miasma increases by 9999"
"eaa4fa87e29c23cac5354198b3e5ab5d","The remaining poisonous insects cannot be wasted!"
"877029b4703e880f1e6ca64557b9fabb","You grit your teeth, raise your hand to clean up the remaining poisonous insects in the poison pool, and collect them all! "
"339df3ead51f6f11a5558c1185baae3e","Great harvest! Leave! "
"7a9f15a928702a17bc5fbde13d2dd6ed","【Leave】It's done, leave! "
"9b110dc2c88c778abc0d0cc3f6a822f2","【Leave】Forget it, leave! "
"402c8b4d09295be176ce070bb932dd3f","Ты настоящий злодей! Я не могу справиться с тобой в одиночку, но против нескольких врагов даже тебе не устоять! ! !"
"df9077ab0012dc374b748f2bbbf3340b","Замолчи и сражайся!"
"4bcc8d4e39774b6601905c8ea9642624","Уничтожьте его! Имея дело с таким негодяем, как этот, правила чести неприменимы! !"
"f242cacc2064f86fd7e7d16fd1a2dc01","Из-за вражды {0}{1} и их товарищи пришли, чтобы напасть на меня вместе."
"025a1658d5eaebe2a9123d8672c4677f","Попробуйте использовать деньги, чтобы уладить вражду"
"9b8bc1b69694ce9bdfcfb831b35a8ab0","Мы не отпустим вас без 500 000 монет! ! !"
"07db698c539461d13b70140d6e8c5639","Нужно больше денег, чтобы избежать неприятностей..."
"0491cae32ebfa21173a52155829d2d13","Конечно, если вы искренни, мы поделим деньги. Давайте двигаться дальше, но вы должны поклясться, что больше не будете нас беспокоить! !"
"0dac475ea20be813a853386471c65f59","{0}{1} и их товарищи пришли, чтобы напасть на меня. Я потратил 500 000 монет, чтобы разрешить ситуацию."
"2f5ae7b385cc68fe55193dd9f2d87cc2","Поверим им, так как деньги уже заплачены"
"029e4b3dce88f56e5484f187305ee213","Отдам им все деньги, которые у меня есть, а с остальным рассчитаюсь позже"
"54faeaeaace13dafc42f38fe794d9af6","Хорошо, мы пока возьмем эти деньги. Рассчитайтесь с остальными, когда сможете. Мы возместим ущерб, но вы должны пообещать, что не будете мстить!"
"28072a8ec71cd7e5c01c8eba393002a0","{0}{1} и их товарищи напали на меня, требуя 500 000 монет, вогнав меня в огромный долг."
"ff6a7e95e6b3c3dc9b1b9b3aa6f2da20","Я влез в огромный долг..."
"7a1b4b7b3128652c79f18fd8c7eeaa88","Это безумие! Я отказываюсь! !"
"df575465bde3d8acd1483c193c1ff0cc","Возможно, не сумев победить, симуляция смерти могла бы стать хорошей стратегией"
"45a464391e86937d5833bf244804ca19","{0}{1} и их товарищи пришли и напали на меня. Мне пришлось симулировать смерть, чтобы избежать неприятностей."
"5cf77871190a7f0b7fab9022c0dcf671","This is it, the sharp breath is emitted from this sword-like stone mountain. "
"3df351cb7e6425e5dabfaf7f03177924","Observe carefully"
"597c547695f87ea8bf30e4611093568c","The edge of this stone mountain is sharp, not formed by natural weathering, but more like it was forcibly cut out with a sharp sword move. "
"c5b05859665e3beecd2cd2a1648cbfe3","If you can sit and meditate here, it seems that you can make some progress. "
"e4e6a2d587f69f4bfba4d3805b7384da","This breath is extremely sharp, and absorbing it once a day should be the limit. "
"f53043ab2b1096f80936561720c38ab8","Sword Qi"
"dc9f96e81006d239c923c5e36cd6c287","Perceive Sword Qi"
"374050cb11f54b5aa7d90828e68f18dc","It may be helpful to meditate under the giant sword of Feijianping."
"21e4b925702ecf3670467fc2906d4ba2","Go to the sword-shaped mountain of Feijianping to meditate."
"52744c76b8ad2b1ad844d2da9c9e5c08","After watching for a while, I felt dizzy. If I had a better ability to use weapons, I might benefit from it. I will try it again after improving my weapon ability."
"41cfc9cc2975d0a2fa8fe7fde3973d50","Just as you were practicing qigong, a sharp breath rushed into your body through your limbs, hair, and pores. For a moment, you felt that your internal organs were burning, and your internal organs seemed to be cut by a sharp sword, and you felt unbearable pain."
"472cd9f2a3cea83e2ed7eb3937f33b55"," (Practice) Guide it into Dantian"
"7a2366e1692fb7b82532f1c8f51593f8","Observe the face and the image in silence, and search for the source of the Tao. \\nPractice the circulation of the meridians in the Taiyi furnace, and practice the Samadhi True Fire. "
"099fc5c63d88727f8fbeeac0ce16655d","After this sharp breath is introduced into Dantian, its activity is lost, and it settles into your Dantian and turns into pure true qi. \\nIncrease true qi by 5 points"
"a9947667baef00631a99183ff2a4c86b","What a terrifying breath, I'm afraid this is the sword qi left by a sword master, which is sharp and hurtful. But if it can be guided, it can turn danger into safety and even be quite helpful. "
"20220447d212f521eb45bf131e81fefa","Is it left intentionally to help future generations? It is not clear yet. But the sword energy is terrifying, and now it has reached its limit. Let's come back another day. "
"88e1348b7289910f573c22a89e7df8a4","Come back another day"
"76bfe389af668311e6545e5f2873d2fa","(Practice) Guide it into the Qi channel"
"b28ee97033f31010aa17fab83ba53c7d","Guard the Huangting, and practice the Xiantian Dao. \\nQuiet and leisurely observation, revealing the mysterious wonder. "
"b6d7b00956ebc0e4e5fd1b1ac8993918","After this breath entered the Qi channel, although it was still wild and unruly, it was no longer sharp. After a cycle, it disappeared into nothingness. It actually widened my Qi channel because of the disaster. \\nQi and blood increased by 50 points"
"158d8c97fc35db02b94ca93aad1d613a","I have already tempered my body with sword energy here today, so let's come back another day to To avoid hidden injuries."
"2852f271774830c42f2f8e0e15564041","The sword energy here seems to be unable to continue to temper my physique."
"271b375b3c09f387b81b2378d8da78f8","I don't know who left this sword energy."
"914887e65f2f3a0a63288a08a4ec3788","On the giant sword on Feijianping, there is a sword energy left by a master. If you can absorb all of it, it will be of great help to your skills. Let's go and see it another day."
"073448d84614b134b5a9e8972a4711ed","I will go to Feijianping to meditate and absorb the breath another day."
"a2b4a2d5ce9c2adcbe8e0a5b49d8d380","Hmm? Why do I feel a chill for no reason?"
"d0d86c2a0b03def2dfc552653e5948fa","? ! "
"895f067f193e287830ad2296985b4506","Suddenly, the mist rose up and I couldn't see anything. In the vastness, a cold light flashed——"
"21bee5531ab94bd94f27164f510aeb30","Who is it?"
"325c65194b415ca4e75a8796f2aa392e","The newcomer hid in the mist, and his appearance was unclear. Before I could take a closer look, he attacked with another sword."
"3dc00541a379039a48204f2f2776c9ae","Ha! Ah! Ha!"
"c61ba3cba3886036a5dacb7b2e3bab0f","What are you doing?!"
"1d2a5724e6da628d816ccdcaec41355f","Huh - stop practicing!"
"cb0b92587a8da2634d15c848d7cfb8fc","Hmm?"
"d785f6e5e649b4f65a61093b08c08e72","Who are you?"
"b79717a799bf4a12f75a78ce4d503aa7","I am Wu Jianglong. I was practicing martial arts just now. Because I learned hard skills, I made some strange noises when practicing. Please don't be surprised."
"939d70eaefc0e209c1f1f09b0ca3c094","But I heard that hard skills need external force to be tempered to achieve success. I didn't see you have any external force to help you just now."
"f26d2938304541737eafc68f3491ee8e","Haha, it turns out that you are also a man of the world. You don't know that this place is called Feijianping. When the Northern Territory went south, there was an unknown swordsman who faced the bloody Northern Territory Thirteen here alone with a sword. "
"36ffd265936dad117d23e480cc0d664e","Both sides are masters of the time. The energy they left has not faded for years. The remnants are here. As long as you practice Qigong and Qigong, you can feel a sharp energy that penetrates the body and is enough to temper my body."
"b6086adc0a87fbda675103fede3c248c","Haha, if there is nothing else, I'll take my leave. See you later."
"8c587148f8f5c9e065dcd7505c0e14e6","Huh - strange?"
"22b1593b5a0ebbff6a674a8dcfdc5eee","Hmm? What's wrong?"
"4cc74cd6ea7ce1687b18941ee34f94c0","I'm Wu Jianglong. It's really strange. There used to be a sharp breath here that could help me temper my body. Today, for some reason, that breath is gone."
"059f82a8af76d864e37a317719596ad8","Sharp breath..."
"b8bba10b748a32d6207e457ffe9e3fe5","Yes, this place is called Feijianping. When the Northern Territory went south, there was an unknown swordsman who faced the bloody Northern Territory Thirteen Swordsmen here alone with a sword and killed them all. Kill them here."
"3ce0a4fcecc35b20084a05a580c48a9d","Both sides of the enemy are masters of the time. Their energy has not faded for years and remains here. So usually, as long as I practice Qigong, I can activate Qigong to temper my body. But I don't know why the Qigong disappeared today. "
"00587c5c8ef44a14de41cc50d15130d5","Uh, why don't you try again another day?"
"859da029e25ad2e49a83b73581f112c5","Alas, this is the only way!"
"491a09e0ad19d0bdb4e4ac070ec57db7","【Tempering Bones】Practice Qigong and Meditate"
"d6c38c8d7a93a26c8c06b5df6a350aeb","The turbulent flow continues, and the blood is moved to strengthen the body"
"a82cf7b400e8908edd818e44aad1c42f","Huhuhu——"
"cb0bea8c090c44f6919f72909911616c","Well, it seems to have improved"
"8080a4bee0ead7ed0f08cd9c7d3fd8ca","After the waterfall body training, your Qi and blood have improved. \\nMaximum Qi and blood increased by 50"
"ca6072b3311d7aee241ae3c994cfdd34","It feels like it hasn't reached the limit yet, let's try it another day."
"b594284349c8a1122b08605aed16102f","【Leave】I'll come another day"
"54a8b3e9744321fc2d649d81e211706e","【Forget it】I'll come another day"
"202d4c482774e7965bcd6065825f3ed0","Although the turbulent flow of this waterfall can exercise my muscles The body, but if it lasts too long at a time, it will hurt the body. It is better to come back another day. "
"4716d96f637d1364a32790df8479b0da","The waterfall is turbulent and falls to the sky, making a majestic sound. "
"08d1f848b3f10c67294a833f604b6811","The water flow of this waterfall is amazing. Practicing and meditating here should be able to strengthen my muscles and bones and improve my blood and qi ability. "
"3f5bf0c4e874628998d877b332ece63f","It has improved indeed! "
"c334927a74f29667d77e540b35b75364","Oh, what should I do?"
"08272bd2a0771484de257992a8c1b5cf","Oh, what should I do!"
"9151924f7ee4e9fc567ff7dd2e27661f","What happened? "
"e465de288008bded6206f541c4abff2d","My dear, I am a blacksmith from a nearby village. I usually come to this Red Cliff Grotto to mine, but recently, for some reason, a monster suddenly appeared in it and occupied this place as a nest. Now I can't enter this cave to mine. I don't know what to do. "
"a0b6c0586149a836ba73a7bbb30ea872","【Persuasion】Go to another place to mine"
"96ec3c105c48748e0d9114923c0cdc0e","Alas, now it seems that this is the only way. I will go to other places to look for mineral deposits. Goodbye."
"11adb6c969e2e13681ae93cff3cfb290","Alas, I can only go to other places to look."
"7969f62e1018535fa25bdfea43673248","До новых встречи."
"5d75896c9b81f029120bf811e2a33b26","【Eliminate harm】I will help you get rid of the monster."
"1d220e956c636bd6b3ded90661ad902b","Thank you very much, young man. If you can help me kill the monster, I will definitely reward you generously."
"9488bb7e23c351410d5b30b66f599983","No problem."
"4c7207f6d1df80a082aa7bb6431e53fd","The monster is in the cave, young man, please be careful."
"64491c2235b7dbe51337d8db57f65c2d","Monster in the cave"
"7648fc67ee3cce2514ae2ab9b6912bc8","A monster appeared in the redstone cave. The blacksmith {0} who often goes to mine asked me to eliminate it."
"53ecc50c8b5df14d7b03dbdaffd5867d","Defeat the fire lizard in the redstone cave"
"cb4571b5cd55fc8791f5997be3fd1925","I'll be back soon."
"5353905d4e267171f7411666f1538693","Why are you unreasonable!"
"fa7a3983a6f8f7d4fc44338efe79af88","You are really unreasonable. You insisted on ordering Biluochun, and you don't admit it after ordering it?"
"c0439efef5676bd213525ae815999826","Humph, you are a black shop, take a break, a bowl of Tea, you want 500 coins from me, I think you are crazy! "
"64229722a5646b969b0477b33b04a013","I said I won't give it to you, what can you do to me? Humph! "
"439d6dac8d3b647772a9c643275f39e3","You, you are really not a human being! "
"0427fc2544d595ed5bb9fec1458ee25f","A pot of tea"
"684a3e07815395475aa5e5fdf8f3cdb5","I just saw {0} arguing with someone, I don't know why. Let's go and take a look. "
"3100a7c2da054de02621b0d116e648d2","Talk to {0} and ask the reason"
"1e0cfcd65503a75c73760dae602ffe92","Let's go and see what's going on"
"06246135478f134cd69fd943a501a338","Absorb heat during mining to improve the ability of the moves. \\nBoxing attack power increased by 2"
"ee3de9b94835358fb54be4b6035603fb","Absorb heat during mining to improve the ability of the moves. \\nPalm attack power increased by 2"
"0afb69450957fb7d377950e637d12a61","Absorb heat during mining to exercise the ability to withstand. "
"d14a9276e33b3288bf6adeccbe4829d6","The heat here seems to be unable to continue to temper my body. "
"afd69dccc3caef7d7e58b38c05242418","The ore in this cave is boiling hot, and it can be fed back during mining Heat entering my body helps to increase blood and qi!"
"a702002c23bba16b097711c39dfd0bd6","The ore in this cave is boiling hot. When mining, it can actually feed back heat into my body. If I can keep the heat above a certain level, I may be able to improve my ability."
"79e8edc6a9e347fb886d741dfaffd96a","Ты смеешь сажать в тюрьму мою семью, освободи его сейчас же! !"
"3de54a6792629796888bdff6f2e1077e","Я был заключен в тюрьму, и моя семья пришла, чтобы спасти меня"
"5f60244a7a8bedaae308f5694c0c25e4","Я не хочу снова с вами конфликтовать, поэтому друзья, прошу, давайте поговорим."
"ea03fcb8c47822bce772cf6c07d0ebbb","??"
"f09182f0d4b4be23255f18f73d0dc3ab","Да, меня попросили помочь им помириться с вами. Улаживать старые распри мудрее, чем создавать новые. Отпустить прошлое - отличная идея."
"72f5e081d026f652d3c5c6711958118d","Это именно то, что я имел в виду."
"623a8766070f8db49b134d38eec87058","Отлично! Давайте пожмем друг другу руки и оставим это в прошлом."
"56725dff8d7e5254a9fa83fd3ed72e1a","{0}{1} попросили своего друга помочь помириться со мной и разрешить наши обиды."
"6c5903ec9087ee2f1623164f63cfbe33","Вражда утихла и отношение изменилось"
"93d52376102285b2400965e6e7788faa","Решительно отказываюсь"
"69207cb489e8dd903f2ff8107b44abd5","Всегда лучше иметь больше друзей, чем врагов. Давайте оставим эту вражду по моей просьбе."
"17a0d7e8cfdb963c7a4374d255406d5d","Неохотно соглашаюсь"
"d3fe2b9ea80b69a6d984d82c269310d5","Боюсь, я не могу согласиться"
"05e83fe14a44488acc89a68209b3c099","Почему ты такой упрямый? Если ты согласен, я готов предоставить карту сокровищ."
"db2ef84e1db4c42c5f13e1c17781f04f","Получил карту сокровищ"
"e3a2917735a63f00979c131875b9d929","Это нереально"
