"# 文本key","文本value"
"2dcbf945beda2fc975631e125b1cd366","Master, you're playing with words. Humans can speak and communicate, but this monkey can't talk. How could it be considered human?"
"d4b07cd4259752555e10ab32ad534feb","Are mute people not people?"
"7cb58ea8d99a34fef17c14a18c12659c","Huh?! This, this..."
"4d3399d85814a5f2a98677bee2dfe4ec","Interesting."
"a7b706fa9ebceb110e6a0055fe2742a1","No, no, Master, humans distinguish between good and evil and understand emotions and reason. Understanding worldly matters is what makes one human, not appearance or the ability to speak."
"b55dbc2bf5141be189303a5ce8a89af9","Hmm, what you say makes sense."
"4937d9bd98832f4e34edcc4d9fb1d324","Hearing the monk's words, the monkey surprisingly bowed and apologized to the villagers, leaving them bewildered and unsure of what to do."
"90ef85f65d2fcd8bb085d49a4fb468ed","If you are sincere and promise not to trouble the villagers again, make three calls as a vow."
"7df0c9633d2d11eaefbb2b0c4a448a82","I was wrong, I'm sorry, I apologize."
"ac144089ce1b8626afbb61ef9f895053","This master doesn't speak the language of beasts, yet he can communicate with this hairy creature—how interesting."
"0e0951ea46de56e023f6092b03946e2a","It actually did it. Could it be, could it truly possess intelligence? Is it... a person?!"
"2209bb2a2eb1969329e5396b04c3b8ad","The three villagers were truly perplexed at this sight. On one hand, this hairy creature did indeed steal the herbs they relied on for their livelihood. On the other hand, as simple and honest people, they knew that a sentient being shouldn't be met with violence. The clash between property and the life of a sentient being left these kind-hearted villagers unsure of what to do."
"14f5cae65e87a04ad541204e98168d84","(Even so, these villagers have indeed suffered a loss. Words alone can persuade them, but should we just disregard the villagers' livelihood, letting them suffer without even the right to vent their frustrations?)"
"ceec597b0ef09797e9d4cfcfe5d5965d","【Thinking】"
"3a8b6aed32452b36ef07489b386c5757","May Buddha be merciful. I, a humble monk, have some alms money with me. Perhaps it could compensate for your losses."
"0b00f7383bbac18b13c881f1d511a6fa","This... this creature has come several times and caused damage worth at least 2,000 coins, and you only have 1,000. That's clearly not enough."
"82009c287f2d85b753992fb57e0f7888","You notice the struggle on the villagers' faces. They wish to do good, but their lives are not easy. It's not that they lack compassion; rather, their difficult circumstances cannot be ignored."
"b8904e99b62d716b9abb57b800c58773","【Persuasion】 Offer to support the monk."
"12b682a848c0266cb5c062b1456f9d28","In this world, it's not just about reason but also strength. This monk has been earnestly teaching you to be virtuous; how can you not humbly accept his guidance? If the master were to use force, you would quickly learn the meaning of 'man dies for wealth, as birds for food.'"
"4ad749729521aed7ec725a64728ebbad","Benefactor, this..."
"af52d4d266e4b89ea8cb10c973fd388e","The monk wanted to say more, but you silenced him with a look. After pondering for a moment, the villagers reluctantly nodded."
"a513d5c19a0ad82b2e0424106c32b2e3","Fine, let this be an act of kindness. But let it be known, if this creature causes trouble again, no one will be able to plead on its behalf."
"103b87e80ee58606fa613f4359b8da55","Sow good deeds, reap good rewards."
"3e7672a06c3bc782b6569ecf29073cfe","This can also be considered an act of charity."
"30e9585eb5152d7e554a1e1dcab7a03c","Let's leave it at that."
"d86a6c07a49fb468d3ef2380fd275cd6","Is it really a person?"
"fdaf067ee4fd0d664cc8ae7d390f79ee","【Give】 I'll cover the cost."
"51770d327cb31498ab2273ce26951305","I'll cover the rest on behalf of this master. Please count it and see if it's enough."
"102db80210ad430d148a927585098ee7","Benefactor, this... thank you, benefactor."
"a22fff3697565d6940b7e7f990e24492","Seeing you offer the money, the villagers nodded, each breathing a sigh of relief."
"013ca5f238ed4bcac479211dbc655185","That's enough, that's enough. We don't want to make things difficult. Under these circumstances, this is the best outcome. We will take our leave now."
"c47817c71bab9c5eac0c06f60ed4ffc5","That's good"
"404f84aae0b568810f34a9aab709d89e","Chirp, chirp, chirp."
"87a7433a21d7136c9d3ab2291bad44aa","Вы видели, как к вам подошел мужчина в оцепенении."
"eb377b7b9b6a7530d7d798a0170af09a","Этот мир опасен, давайте прекратим убивать людей. Вы убили так много, что вы будете делать, если члены их семей придут мстить?"
"44c7bf2186676111e18266626d24a441","Подойди один, убей одного. Подойди два, убей обоих!"
"bdc5d429dcb2fb8c951b41362fb0ef86","Ты кровожаден и они ищут тебя, чтобы отомстить, поэтому ты, естественно, не боишься. Что, если они найдут меня? Ты не волнуешься?"
"3055254eea6225c653b6b7e7176fe768","Убить их всех и никто не будет мстить."
"38f5d749c0d42db07244e389b0d86ab5","Ты ... ну, мы с тобой не сходимся характерами. Когда в будущем меня не будет рядом, ты сможешь сделать это сам."
"823472e2bb4086621c0b42ee77507f75","Если вы со мной не согласны, давайте прекратим это."
"f816d3a691ef3af3ea81681d249f272f","хорошо....."
"92ac6dcecc84cb830d2b0b8770a070fb","Не нужно быть таким категоричным, я обязательно изменюсь."
"04d29706c690024d08bd6cc4429e517f","Если ты действительно сможешь это сделать, это будет благословением мира боевых искусств, а также моим благословением."
"dfa54f3c0b0ca35cae0b5bc6519939c7","В будущем я буду совершать чуть меньше убийств."
"241144bfe846d40012dacae112f4936b","Ты моя настоящая любовь, как я мог не беспокоиться о тебе."
"8691ed3d2672c4dd20c18af4359d74dd","Если ты действительно любишь меня, тебе придется прощать и прощать других в будущем, так что не делай больше зла."
"5527e0f841c90e99a2d2fa76d5f4ff93","Вы правы, в будущем я буду совершать менее кровавые преступления."
"0aee91a918bfac1880f7229aa76b0e5c","Это все, чего ты боишься?"
"e4eac9dcc0a2ae073af5f40658fcdb27","Ты ... ну, это все, что я должен сказать, так что решай сам."
"b298a441157bfa0580d43aa488f5c203","Сбит с толку."
"a64aea67998bb359f569f4aaf415cd0c","Ты прав. Я действительно убил слишком много."
"a28a988d711fb9f8a619f9fda0e3259f","Мы с тобой лучшие друзья. Есть некоторые вещи, которые я видел своими глазами и я должен сказать об этом сейчас."
"628eb90aae848f3ce7d5b413f20122f2","Мы с тобой близкие друзья, почему мы не можем просто сказать это?"
"f87f72b5685272811b602bfdab8834a1","В мире широко распространены слухи о том, что ты убийца, который убивает невинных людей без разбора. Многие люди с высокими идеалами даже хотят избавиться от тебя. Если ты продолжишь так себя вести, твоя жизнь будет в опасности."
"4a5995c2ab5cad8ccba948bae8b87814","Моя сила настолько велика, что об этих насекомых не стоит беспокоиться."
"61bf7671fa1cdaea871c193a4acd53bd","Легко увернуться от открытого копья, но трудно защититься от скрытой стрелы. Даже если ты непобедим, сможешь ли ты предотвратить отравление и покушение? Увы, на этом я остановлюсь. Просто береги себя."
"a8a12ac862c00ced1447b9ebe570c615","Повторяю еще раз, я непобедим."
"23a9fda713bcdb98d04b949499c9d67f","Ты прав, я действительно убил слишком много людей."
"a3d6011e563eca56154d0d51a1ae4bf7","Хорошо, что ты понял. Как твой друг, я очень счастлив."
"97d8d7bc1b8bf6b06d69143ee891b9c1","Если вам трудно говорить, тогда не говорите этого."
"f45a0e224a2c98dc4cfada47dd3fdff0","Что ж, тогда справляйся с этим сам."
"8f02d060ae7862573cbbe8d40e9b6067","Мы с тобой кровные родственники. Видя, как ты много убиваешь, я не могу не волноваться за тебя."
"844458dbcc23803d49567a810dca0674","Что ж? Мы близкие родственники, так почему мы не можем просто поговорить об этом."
"19858153ea5cf6edafcc67aee9e6d722","Я не знаю, с каких пор ты неоднократно совершал преступления. Я часто слышу, как люди говорят о том, что ты убиваешь невинных людей без разбора. Я не помню, чтобы ты был таким человеком..."
"1c0f6d1a1b029c4eb4ca1d53500910d3","Я стал таким..."
"dcfa7d5c0f7402009e87cb1be643a705","Я слышал, что многие люди с высокими идеалами горят желанием испытать тебя и хотят убить, чтобы прославить своё имя. Как твой ближайший родственник по плоти и крови, я"
"db6706801b003e5cbf55ea334170dff0","Хотя я был виноват, они посмели составить заговор с целью моего убийства! Черт возьми!"
"50e21a094a0a51310e3e81ec0472321a","О, одно мое слово снова сделало тебя убийцей, вот и все, просто береги себя."
"4b1c6f3aece268d6b7e50512a769d984","Я ошибаюсь? Они заслуживают смерти!"
"3c665acabb881ce8f38e64db83e3f54a","Я просто надеюсь, что мне еще не поздно повернуть назад."
"a2cb135d7720428c63fc663dc738c7ab","Хорошо, что ты понял. Как твой родственник, я очень счастлив."
"15039cfd653375bcd7c3fe6b95eed982","Ты неправильно запомнил, вот какой я!"
"14273b4721d7ce1745f0cdf73b436131","Даже если вы близкий родственник, пожалуйста, не указывайте пальцем на мое поведение."
"8aef62bde27c4be2ca3f2f4ebdb5ccb0","Недавно я услышал, что в мире есть убийца, который убивает невинных людей без разбора и является кровожадным маньяком. Это ты?"
"6b65e9863d6b877c5bcb214e75871b1a","Что, если это так? Что, если это не так?"
"aa1cbf7413029c84717cf8dcf8ca82aa","В последнее время в мире появились люди с высокими идеалами, каждый хочет убить вас. Хотя все говорят, что вы убиваете невинных людей без разбора, я чувствую, что морю страданий нет конца. Если ты сможешь прекратить убивать сейчас, ты также сможешь накопить некоторые благословения на будущее."
"732d9d7b0dd5618c67019603c670a47a","Это шутка. Этот мир - поле для убийств. Ты убиваешь меня, а я убиваю тебя. Как ты можешь быть невиновным?"
"5862da079249f5d7eb804c1821bf9851","Эх, ты упрямый, так что береги себя."
"05aa0d2ef5b1d5a826171ad09b5fb3d4","То, что вы сказали, имеет смысл. В будущем я сделаю все возможное, чтобы убивать как можно меньше."
"65a4c8c6f8c944856cb6ae81ae09c2ed","Это благословение для мира и простых людей, что ты можешь так думать."
"fdae52f31dcee9e0f2085c565c7e2bca","Leng Ruyan, the martial world is vast. Must you be so aggressive and push things to the point of life and death?"
"eed83250f90af4704dde7cfa24b2c41d","Hmph, Feng Kun, did you think about today back when you killed my sister for the secret techniques of Mount Beiwang?"
"8aab08f0220c93e3c939243bed1db960","...What is this?"
"57ce787ee52277920d9970c34eb14bce","Hmph, you refuse a toast only to drink a forfeit. Unfortunately, this time I brought some help. Brothers, attack!"
"0cb265b330476c2419ad8eafffc84136","Hmph, scoundrels colluding together! Take this!"
"84d9bf79c3c275333a845db394135317","Me? What about me?"
"8f37c76cbee75c8c93d576641196c88e","Wait, I don't even know him."
"ab51cd00d60d1f8bc5ce632372130145","With such skills, you choose to aid the wicked and forsake the righteous path."
"35eaf16903d3e551f44ba35452cddc1d","This is a misunderstanding."
"5b5fac105e770beb7793b1a568e279e5","Hmph, right or wrong, say what you will. Given the situation, do what you will—kill or maim, it's up to you."
"e025502658adc80ad397090e84998445","It's really a misunderstanding."
"1e6faa2adccc8872f0972d9dc6e240d6","Enough with the talk. Do you think I'm as naive as my sister, easily fooled by a scoundrel like you?"
"eb38becb6d19186f390c1fea19541bce","How else could I deceive you?"
"e5fdf2e4ac6e745f0fc49a4c6b0e8404","Who knows what evil schemes are brewing in your head."
"ed090b98b06c290eb9d8fa9d47500523","【Teach a Lesson】 Give the little girl a lesson."
"fca18105d289a23faed835f1549c4318","A brat who provokes should be shown some color; don't think I'm a pushover."
"ff3fbf12fad566bcce676787f22768ec","Hmph, your true colors are showing. Bah, vile scoundrel!"
"6da497c832689417b83af712ee4e6f66","【Slap】"
"5d52592f0ee2538c478652080b9230ca","After you slapped her, the girl's face was filled with disbelief. But soon, her hardened expression softened, and tears welled up in her eyes."
"47214a51ae561872e58f6b1b89c4460b","Scoundrel! Scoundrel! Scoundrel!"
"5a2fba68ecd8cd2e34739f0174831c3f","【Again】"
"71d6cabb272cc3dc2f289d2fb30489a7","After a few more slaps, the tears in her eyes could no longer be held back and began to fall like raindrops."
"f32d60b1ff3402e9607ce74ba8e07edf","Scoundrel! How dare you treat me like this! I will report this to my sect. Any disciple of Mount Beimang will kill you on sight! You will not be spared!"
"b88aa756a79c178555f43a2e02162e0c","The girl covered her face, her teary eyes filled with disbelief."
"121fccfc0b1e5705726304434294f311","Stop, stop, no more."
"d855b002186f99bc38abd7635df10843","Are you ready to listen now?"
"7bbebf7b9526b18cbe3b506607f56afa","You... you speak."
"4b5a8263373aeae95a59b89207164c59","I've already said, I don't know that person. You attacked without distinguishing right from wrong, and even after I explained, you wouldn't listen. If I didn't have some skill, wouldn't you have killed me for nothing?"
"6e090e640273a849318a53e9dbd8d7f9","【Explain】"
"acbaa7bbb54334ab6b9c337896fe0ce2","I... I didn't intend to kill you, I just... just wanted to teach you a lesson."
"fd46f153281bbb95e99ed35cb6b4f400","Hmph, say what you will!"
"a06ce13a2d34b5e52b1f12e2988ad5db","Then what do you want?"
"c8264422023d512a0ce9efd56df1df5c","【Demand Compensation】"
"87e41d40a8a3e5656990685ad40c98b4","I can't just be wronged without compensation. Some things must make up for it."
"32dc032dc3c96fcb99f5c916304715e1","You've hit me enough times; doesn't that make us even?"
"e2fe9e69c945408afbc465a0769c36fb","【Threaten】 Raise your hand to slap again."
"b5bf4c3c9624baf8cb5edbfc15c2e844","Seeing you raise your hand, the girl quickly shook her head."
"517721e154ab6f3f1a746f41c761e794","This Cold Ice Palm manual is the entry-level technique of Mount Beimang. I have nothing else on me, only this. Take it, and we're even."
"f9f28933e623b761094a93d30b3db1b6","【Accept】 Take the manual."
"44e15d3a5b6b4196b497acc028e52505","Very well, then we're even. Hmph, farewell!"
"9f5d10afc636dc6d47c7a3de4d0171aa","Good riddance!"
"708de318f5f897f81b25265f91ec51a6","How infuriating, being humiliated by this scoundrel!"
"62281e7829326fad60e3d6c282812842","【Leave】 I guess I came out ahead."
"370d2d78cc8ad16a3333d1f07902088a","【Refuse】 Ask for a different compensation."
"9d981032bfbf4bea73df675a50091a24","If you don't want this, hmph, I still have some money on me. If that's not acceptable either, then just kill me."
"b481b02770410b5b6b71c6783efee18f","【Accept】 Let it be."
"f04e85d8b5f79aa5b244e13b07235eb4","【Leave】 From now on, let's stay out of each other's way."
"9fde9a1ea4ab4cc27754b5ee61fc0771","Hmph, farewell!"
"4e42ecbd4d1ac1eb8dbc7d0b257d4cfb","What a hassle."
"183bc6741f04881d35b9507317783c60","【Demand an Apology】"
"d6e8bae29eb201a09a458c54b907c02c","I can't just let you falsely accuse me without any consequence. Apologize to me, and we'll call it even."
"b56a3b453cb5b54f5019552e4b5ac099","Hmph, I'm... I'm sorry. I was rash."
"e45c87f478e388e5ffa2a6c893803dea","Until we meet again! Goodbye."
"db523c989fc0674cb1cab08da8c0f495","Wouldn't it have been easier if you had done this from the start?"
"f2840870a169d51d5c229cbd624867d1","【Leave】"
"c395a7372c82355c7ea79c259ffb5532","【Intimidate】"
"e0ffb5905455a3411b6e4be2345b5bee","You raise your hand to scare the girl, but she unexpectedly leans closer, taunting you with her words."
"5a5d08e7ad41e2e1ed0942daaa62524d","I'm an inner disciple of Mount Beimang. You dare slap my face? Go on, do it! Why aren't you moving?"
"a139c0b86da0c186bfbe803551cf9383","【Teach a Lesson】 I've never heard such a request before!"
"b2b2cb8afe9e62fa2b79379e3937a73c","【Leave】 Why bother with her?"
"871775f38707bc18aca9262f5b7ace9b","Hmph, scoundrel, don't think this is over. We'll see what happens next time!"
"68d01c82a16d4f3ac042a5bc93dc5973","We'll see about that!"
"daf5f220b600506cfe3e6aaf67305d13","【Leave】 Forget it, not worth my time."
"bbfde6b8b87b52a352b70c8855751651","【Explain】 Continue explaining it's a misunderstanding."
"22158eafb7e2aebbcdc7e595b1c19af1","Misunderstanding? Hmph, are you saying I have no eyes? Scoundrel, do what you will—kill or maim! Spare me the false pretense!"
"950b07011e60a431df217a78cd6f6435","【Leave】 This woman is out of her mind."
"2f63f649614c6486b7aa3263ac00e35a","With such limited ability, you're running amok in the martial world. You truly shouldn't be allowed to live!"
"b4760be413febac4e99d0869a72a0aa9","Hmph, misunderstanding, misunderstanding. You're full of lies, scoundrel. But I have no time to argue with you now. I'll deal with Feng Kun first, and then come back for you!"
"3b879b64e326ca42c1f61af96268cb69","Where did Feng Kun run off to?!"
"09646b1e131e512282871373a3ee1691","Truly an undeserved calamity."
"f80312d398007007c8cc03eb9cd0864c","Человек впереди вас спешит и случайно натыкается на вас."
"2a70a55bbe404556e9d13b3d44ee8dcc","Прости, прости, я спешил и случайно столкнулся с тобой."
"8bf2cb84a74fa8542639cf17bed7b815","Ты не смотришь куда прешь?(Выговор)"
"80d248ee36ecbd8a9ad1bea5ca69aff0","Мне действительно жаль. Я заплачу тебе 500 юаней."
"7a3edf334e47675a6f117e9699d1f4eb","Вот, пожалуй, и все. Пожалуйста, в будущем будьте более осторожны. (Возьмите деньги)"
"eac9c785880712492107f6ced36e8c0f","Мне все еще нужно сделать кое-что важное, поэтому я уйду первым и поговорю об этом позже, когда у нас будет возможность."
"98aea780ee7ab5fcec760aecd72b1ead","Эти деньги - просто пустая трата денег? (Требуем дополнительной компенсации)"
"1ddfde680f3c801142849ce4f5b9a2cb","Что ж, давайте добавим еще 500 и компенсируем вам 1000. Как насчет этого?"
"0f3e3ca4920cc1a5f007ce58984e1141","Пожалуй, достаточно!"
"e59e483f8ddb04bc6c408a4bdaef4609","Забудь об этом, тебе лучше отдать все деньги!"
"54b893cc9784400c412526791e4621fe","Ну, я не хотел столкнуться с сильным человеком! Давай, я хочу посмотреть, сколько у тебя трюков, чтобы ограбить меня."
"7d76a4f9ead6559ed57a9ce14218da70","Давайте начнем."
"c2a22df2505427d7f09aaa03d0c65127","Слегка улыбнись, чтобы показать, что все в порядке. (Дружелюбно)"
"38d8f2f0aa06d8808981927dfa5fd37e","Недавно мастер боевых искусств объяснял основы боевых искусств. Я вышел поздно, поэтому спешил и случайно столкнулся с тобой, рыцарь.Эти деньги - моя компенсация, я надеюсь, что они тебе пригодятся."
"cf8a458f2d9385b8bf5f84fe73704123","Я принял это со счастливой улыбкой, а это значит, что это тривиальный вопрос."
"4291d7db989bcdd82bbf2f9c7a2e9738","Это просто тривиальный вопрос, зачем давать мне деньги? Просто иди."
"5b0cd494a38c7c9b9ca2b49993a6a166","Рыцарей много, но у меня все еще есть срочные дела. Давай поговорим об этом позже, когда у нас будет время."
"ddd0a618975b29ea3253c86dceeb679b","Я слышал, как кто-то сказал, что у тебя на руках какие-то ядовитые насекомые. Интересно, ты был бы готов расстаться с ними и продать мне?"
"9b54d48099cb1560a64aa71d0436ae3d","Это все равно бесполезно. Если ты захочешь это купить, я тебе продам."
"2abd2d46752b9a82d78c403fa25a8672","Это очень хорошо. Интересно, есть ли у вас эти насекомые Гу, которых вы могли бы продать мне."
"11997ecfebdd64e21b0382248995b321","Светящийся червь."
"a7f907f0a8242efe6eaf8ef49adc1d47","О! Это светящийся червь! Я готов дать вам 500 юаней за это насекомое."
"2cb0260c06597a8fdba2404f181f29fb","Разумная цена."
"f7ef716ee73aae515a3c856a65f562f0","Ты покупаешь, а я продаю, это всего лишь обмен."
"181d7eee8999606d3c5429b17e6b9809","Сделка заключена, увидимся позже."
"17e64ba09422a9fd850b36c88182ee37","Я вижу, что вы тоже интересуетесь насекомыми Гу. Если вы хотите использовать насекомых Гу, вы должны изучать соответствующие боевыми искусствами. Если вас интересует путь насекомых Гу, вы можете отправиться на гору Лунцзи, чтобы посмотреть. Прощайте."
"bc6a89290b83afa9815c88f7b8e40079","Я не хочу его продавать."
"9c84916c1b06faa15d060424b7bb5b9d","Червь любви."
"13c97f18fb187c1841b7dcefeea56ed7","О! Это червь любви! Я готов дать тебе 500 долларов за эту него."
"a462ec3e5c88a058edb564d5aec9c4f9","Кровавый червь."
"ece9cb76f621777fb626589100119c75","О! Это действительно кровавый червь! Я готов дать вам 500 юаней за этого червя."
"d5e3d7fc1f9d166c977154890b93b227","Абсолютное насекомое."
"2aa53e696111550aee31a086c69ce848","О! Это абсолютное насекомое! Я готов дать вам 500 юаней за это насекомое."
"b78cc035fcfcdf7a6b7700546c9a63a9","Мне тоже нужны эти черви Гу."
"787dce43bcba4980e4970e317e9e89a9","В таком случае я не буду тебя принуждать."
"6b9e080f5f5dd4fdad88317e62beb48b","Если ты не хочешь продавать, просто забудь об этом. Увидимся позже. До свидания."
"4298d5a89b51eb200f8b108952cc5913","Сэр, вы знаете, где поблизости есть Храм Городского Бога?"
"99e252057439115cbe893ecf9eca05cb","Что ты ищешь в Храме Городского Бога?"
